sku,name,desc,rating,price,quantity,type,image
247812,2018 Specialized Riprock Expert 24,"Remember when riding bikes was all about having fun? So does Specialized. For the Riprock, they strove to create the bike that any of us would have drooled over as a kid. An A1 premium aluminum frame is lightweight and built to withstand the tough use doled out by kids, while the geometry features an ultra-low standover that makes it easy for your little ones to fit on and grow with the bike. A Custom SR Suntour XCT fork features 70mm of smooth, air-sprung travel for rough terrain, while a hydraulic lockout will make climbing significantly easier for your little ripper. Watch them fly up hills with the Shimano XT drivetrain and stay safe on the way back down thanks to the Shimano Deore hydraulic disc brakes, which are easy for little hands to reach and deliver a degree of stopping power that even you'll be jealous of. Ultra-wide 2.8-inch tires, wrapped around zippy 24-inch aluminum wheels, deliver heaps of traction, comfort, and stability, and ensure that the Riprock is approved for fun anywhere that it goes.",0.0,1000.0,13,24-Inch (7+ yr. old),http://thebicyclechain.com/images/library/large/specialized-riprock-expert-24-247812-1.jpg
263513,2017 Specialized Roll City,"Keep up with your fitness or navigate the neighborhood in search of the perfect espresso in comfortable, efficient style with the Specialized Roll City. Take it out on a bike path—dirt or paved—and enjoy the smooth, efficient ride afforded by the lightweight A1 aluminum frame and unique Ground Control Positioning, which puts you in a more upright ride position and provides maximum comfort while keeping your back and neck feeling fine. Revel in the confidence and stability of the stable 650B wheels, wrapped in wide, cushy Specialized tires. The incredibly efficient 1 x 10-speed Shimano drivetrain makes sure you enjoy easy spinning up that steep hill, and have the high end to tack on some speed if the mood strikes. When you are scrubbing that speed, Shimano's hydraulic disc brakes provide incredible speed modulation and immense stopping power, regardless of the conditions. This way, rain or shine, you'll be able to have full confidence in your ability to react to the road. Ride longer thanks to the Body Geometry science that’s gone into the grips and pedals that keep you comfortable for mile-after-mile. Get out there, get active, and Roll with it! Feel it for yourself.",5.0,1000.0,19,Specialized,http://thebicyclechain.com/images/library/large/specialized-roll-city-263513-1.jpg
273415,2018 Specialized Ruze 6Fattie,"More traction gives you more confidence, and with the Specialized Ruze 6Fattie, you get just that. It's specifically designed from the ground up to give women of all skill levels an advantage on the trail, earning its nickname as ""the ultimate trail hardtail"". Its 650b x 3.0-inch tires put out more traction, more flotation, and better handling without sacrificing anything to efficiency on climbs. And to solidify itself as a proper trail machine, this iteration of the Ruze places a focus on blending durability with performance. To do so, they spec'd it with strong Stout XC rims, a bulletproof one-by drivetrain with plenty of hammering and climbing ability, and a SR Suntour fork with 80mm of travel. Of course, you also get a host of women's-specific components, plus Specialized's Women's Trail Geometry with an ultra-low standover height. It has everything you need to ride harder and go faster, and nothing that you don't.",0.0,1000.0,11,Front-Suspension,http://thebicyclechain.com/images/library/large/specialized-ruze-6fattie-273415-1.jpg
264034,2017 Specialized Sirrus Elite,"Specialized's Sirrus Elite makes all your favorite rides even more fun with its light, lively, and efficient Specialized aluminum frame. The same can be said for its vibration-damping Specialized carbon fork. You'll love the free-rolling, 700c wheels and flat handlebars with intuitive, easy-to-reach controls. From running errands in style to heading out on longer rides, you'll be glad you have a quick 18-speed Shimano drivetrain to conquer hills as well as powerful linear-pull brakes for control on the way back down.",5.0,1000.0,13,Multi-Speed,http://thebicyclechain.com/images/library/large/specialized-sirrus-elite-264034-1.jpg
273438,2017 Specialized Vita Elite,"Hop on Specialized's Vita Elite Disc and enjoy a carefree ride in total comfort. Its lightweight, women's-specific aluminum frame gets up to speed quickly, while the Zertz-enhanced carbon fork damps vibrations and smooths the road. You'll also love the free-rolling, road bike size wheels and comfortable handlebars with easy-to-reach controls. Whether it's a short errand run or an all-day adventure, you'll be glad you have an easy-pedaling Shimano 18-speed drivetrain for conquering hills, and a pair of powerful hydraulic disc brakes for the ride down.",0.0,1000.0,13,Multi-Speed,http://thebicyclechain.com/images/library/large/specialized-vita-elite-womens-273438-1.jpg
302368,2018 Specialized Women's Diverge E5,"The Women's Diverge E5 is equipped with everything you need to head to work, take the long way home, or hit some fire roads on the weekend. The Diverge frame will comfortably fit up to 700x42mm tires with plenty of room for mud, too. Weight was a large factor in the development, so Specialized took some design cues from the Roubaix with an E5 Premium Aluminum frame that's plenty light, certainly stiff for hard efforts, and undeniable durable. Specialized opted for a new Open Road Geometry. We know what you're thinking, ""it's just another marketing term,"" but they truly did develop an entirely new geometry. Think of it as a road version of modern trail bike geometry. It provides playful handling and predictable steering for endless dirt skids and mid-corner drifts. The geo features a bottom bracket that's over a half-centimeter lower than the previous Diverge, a slacked-out head tube angle, short chainstays, and a short wheelbase. These changes make for a bike that's not only fun in the dirt, but also performs well on the road. Specialized topped it off with three water bottle mounts and mounts for racks and fenders. So while it's one of the most smile-inducing bikes you'll ever shred fire roads on, it's equally adept at bike packing, commuting, or even a spin to your local brewery. For the spec, Specialized wanted to make sure that it shifted crisply and braked smoothly mile after mile, so you'll find a Shimano Claris groupset, hassle-free mechanical disc brakes, and a durable Axis Sport Disc wheelset that's been cased in our fast-rolling Espoir Sport Reflect tires. Every touchpoint of the bike is also tailored specifically for women, from the handlebar width to the crankarm length to the renowned Myth Sport saddle.",0.0,1000.0,10,Multi-Speed,http://thebicyclechain.com/images/library/large/specialized-womens-diverge-e5-302368-1.jpg
302367,2018 Specialized Men's Diverge E5 Sport,"With the Diverge Sport, you'll be prepared for anything, from smooth tarmac to the loosest, roughest tracks out there. It's packed with all the same technologies as its pricier cousins, only its spec places an emphasis on reliable performance, not components so flashy you'll be eating nothing but top ramen for months. The Diverge frame will comfortably fit up to 700x42mm tires with plenty of room for mud, too. Weight was a large factor in the development, so Specialized took some design cues from the Roubaix with an E5 Premium Aluminum frame that's plenty light, certainly stiff for hard efforts, and undeniable durable. Specialized opted for a new Open Road Geometry. We know what you're thinking, ""it's just another marketing term,"" but they truly did develop an entirely new geometry. Think of it as a road version of modern trail bike geometry. It provides playful handling and predictable steering for endless dirt skids and mid-corner drifts. The geo features a bottom bracket that's over a half-centimeter lower than the previous Diverge, a slacked-out head tube angle, short chainstays, and a short wheelbase. These changes make for a bike that's not only fun in the dirt, but also performs well on the road. Specialized topped it off with three water bottle mounts and mounts for racks and fenders. So while it's one of the most smile-inducing bikes you'll ever shred fire roads on, it's equally adept at bike packing, commuting, or even a spin to your local brewery. The frame, meanwhile, is topped off with a Shimano Sora groupset, mechanical-disc brakes, and an Axis Sport wheelset.",0.0,1150.0,15,Multi-Speed,http://thebicyclechain.com/images/library/large/specialized-mens-diverge-e5-sport-302367-1.jpg
298029,2018 Specialized Allez DSW SL Sprint Frameset - Limited Edition I,"You're practically dripping with style, so why shouldn't your bike? Good question, but Specialized have the answer—the Allez DSW SL Sprint LTD I Frameset. At the heart of it is their DSW Sprint Technology, which strategically places more welding material where it's needed, resulting in an aluminum bike that's more compliant and considerably stiffer. How stiff, exactly? It's the stiffest alloy bike Specialized ever tested. Drawing inspiration from the Rider-First Engineered Tarmac, this frame has a unique down tube, bottom bracket shell, and head tube, plus fork sizes that correspond to frame size. This ensures uniform performance across the entire size run. Making sure every single watt you produce gets transferred to the road, it has short chainstays that create an extremely stiff and rigid rear triangle. But it goes beyond just pure rigidity, as the hydroformed tube shapes have also been aerodynamically optimized to slice through the wind. - E5 Premium Aluminum frame with Allez D'Aluisio Smartweld Sprint Technology refocuses weld locations, allowing for more material to be placed where it's needed for increased stiffness and compliance where you really need it.- Specialized's top-tier S-Works FACT carbon fiber fork provides incredible stiffness and front end steering response, - The Venge FACT carbon fiber seatpost acts as a stiff, aerodynamic perch for your saddle.",0.0,1200.0,10,Sport/Performance,http://thebicyclechain.com/images/library/large/specialized-allez-dsw-sl-sprint-frameset-limited-edition-i-298029-1.jpg
273975,2018 Specialized AWOL,"Head for the ends of the earth on Specialized's AWOL. This tough-as-nails adventure bike features a steel frame and fork for durability and exceptional ride quality. Equipped with both front- and rear-rack eyelets, three sets of bottle cage bosses, and full-length cable housing routing, the AWOL does double duty as a fully loaded touring rig and a heavy-duty commuter. Sturdy Specialized wheels with grippy 45mm-wide tires make the bike all-terrain capable, and a pair of TRP Spyre disc brakes provide great stopping power, no matter what the conditions. A wide-range, 27-speed Shimano drivetrain has the gears you need to conquer any hill, and a selection of Body Geometry components help to keep rider comfort high.",0.0,1200.0,11,Touring,http://thebicyclechain.com/images/library/large/specialized-awol-273975-1.jpg
273404,2017 Specialized Dolce E5 Elite,"Specialized's Dolce Elite E5 is purpose-built to take you places—both physically and geographically—and make sure you're enjoying the best ride along the way. It's the perfect bike to introduce you to the sport, taking you to new levels of confidence on your cycling journey. At the heart of it is Specialized's DSW technology, which strategically places more welding material where it's needed, resulting in an aluminum bike that's more compliant and considerably stiffer. How stiff, exactly? It's one of the stiffest alloy bikes ever tested. Drawing inspiration from the Rider-First Engineered philosophy, this frame has a unique down tube, bottom bracket shell, and head tube. This ensures uniform performance across the entire size run. Making sure every single watt you produce gets transferred to the road, they built the Elite around their Women's Endurance Geometry. This ensures that you stay comfortable and confident over any kind of terrain, while also providing a lower standover to make getting on/off the bike, as well as putting a foot down, as easy as can be. For the build, they spec'd it with Shimano Tiagra 10-speed shifting, fast-rolling Axis Sport Disc wheels, and traction-packed Espoir Sport 25mm tires.",0.0,1200.0,13,Sport/Performance,http://thebicyclechain.com/images/library/large/specialized-dolce-e5-elite-273404-1.jpg
304260,2018 Specialized Dolce Elite,"The Dolce Elite is the perfect bike to either introduce you to the sport or to take your ride to new levels. It's purpose-built to take you places—both physically and geographically—and to ensure you're enjoying the best ride along the way. Making sure every single watt you produce gets transferred to the road, Specialized built the Elite from their A1 Premium Aluminum with Women's Endurance Geometry. This ensures that you stay comfortable and confident over any kind of terrain, while also providing a lower standover. Essentially, this makes getting on and off the bike, as well as putting a foot down, as easy as can be. For the build, Specialized spec'd it with Shimano 105 11-speed shifting, fast-rolling Axis Sport Disc wheels, and traction-packed Espoir Sport 25mm tires. Of course, every facet of the bike is tailored specifically for female riders, from the handlebar width, to the crankarm length, all the way down to the superlative Body Geometry Myth Expert saddle. - The Dolce Elite's sturdy and reliable A1 Premium Aluminum frame is built with Women’s Endurance Geometry and delivers two important benefits. This geo improves stability and handling, giving you confident control when climbing and descending, while also putting you in a less aggressive and more natural ride position. The result? Hours upon hours of comfortable riding. - The agile and responsive FACT carbon fork features Zertz inserts to absorb road roughness and give you a smoother ride. - The Body Geometry Myth Expert saddle has been specifically designed for women, delivering hours of comfort no matter the terrain.",0.0,1200.0,13,Sport/Performance,http://thebicyclechain.com/images/library/large/specialized-dolce-elite-304260-1.jpg
273911,2018 Specialized Fuse Sport 6Fattie,"More volume + versatility = dominance. Solve the equation for yourself with Specialized's Fuse Sport 6Fattie. Rolling on 650B x 3.0-inch tires, the Fuse Comp delivers unprecedented traction and stability so you can shred the most off-camber, rock-strewn, loose trails you can find. The solid A1 aluminum frame features Specialized's exclusive Diamond Stay technology to accommodate 6Fattie wheels and tires while maintaining the short chainstays that keep a bike playful and fun. The spec is dialed with a bomber Suntour XCR fork, Stout wheels, and a 1 x 10-speed drivetrain with a wide-ranging cassette. Get on a Fuse and discover that more tire = more fun.",0.0,1250.0,13,Front-Suspension,http://thebicyclechain.com/images/library/large/specialized-fuse-sport-6fattie-273911-1.jpg
311752,2018 Specialized Men's Sirrus Elite Carbon,"Sure, getting in shape takes hard work and plenty of sweat, but that doesn't mean there's no room for fun, right? Our Sirrus Elite Carbon was designed to liven-up your fitness routine with a host of smart performance features that'll have you smiling as you sweat. To do so, we started with a high quality FACT 9r carbon fiber construction that's lightweight and extremely responsive, not only making the Sirrus a better climber, but also making it easier to carry up the stairs after your commute. Then there's the crisp and precise shifting that comes at the hands of a microSHIFT & Shimano mix of components, powerful hydraulic disc brakes, and all the comfort that follows our scientifically tested and engineered Body Geometry components. So as you push yourself to reach your goals, you'll feel more connected to your bike than ever. It'll leave you feeling like you have the perfect partner on your path to health and wellbeing. - The FACT 9r carbon fiber frame is engineered and designed with our Fitness Geometry, helping you ride more efficiently in a position that will see you riding comfortably, mile-after-mile.- The lightweight FACT carbon fiber fork provides a smooth, responsive ride, while the Plug + Play fender mounts give you the option to install rain-fighting fenders.- Braking duties are handled by TRP Flow Set Control hydraulic disc brakes to ensure effective, consistent, and reliable power through any kind of terrain or condition.",0.0,1350.0,13,Multi-Speed,http://thebicyclechain.com/images/library/large/specialized-mens-sirrus-elite-carbon-311752-11.jpg
273914,2018 Specialized Sequoia,"A 100 years ago, there were no road bikes and touring bikes—there were just bikes, and that didn't stop anyone from heading out into the wilderness. With this spirit, Specialized built their groundbreaking Sequoia. The Sequoia's path to adventure starts at the frame, which Specialized constructed from Premium Cr-Mo and stainless steel tubing. These materials are coveted for their strength, respectable weight, and tuned ride quality. Of course, this is only a piece of the equation, with the next being its dedicated Adventure Geometry that provides ample confidence over rough and smooth terrain. This geometry is unique in that it skews the line between a traditional road bike and a dedicated touring rig. You'll find an ample wheelbase and low bottom bracket for control, but the chainstays and tube angles ensure that you'll be able to travel efficiently and quickly, regardless of whether or not your rig is loaded. Digging into the details, the frame is outfitted with an ample number of mounts for bottles, racks, and fenders. And for the build, Specialized included reliable parts, like a mix of sturdy Shimano components, fuss-free mechanical disc brakes, and hand-built Hayfield wheels that are cased in wide, 2Bliss Ready tires.",5.0,1350.0,17,Touring,http://thebicyclechain.com/images/library/large/specialized-sequoia-273914-1.jpg
263583,2017 Specialized Sirrus Sport Carbon,"Built to roll with speed and with looks just as fast, Specialized's Sirrus Sport Carbon thrives on getting you there quick, and in comfortable style. A FACT 9r carbon frame and fork deliver a bike that just begs for you to jump on it, and ride farther and faster. You'll love the fast-rolling 700c wheels and the heads-up flat bar position with easy-to-reach controls. From beat-the-traffic commutes, heart-pumping weekend rides, to entering that event you always dreamed of competing, you'll be sure to have the gears you need with the light, versatile Shimano/FSA/Microshift 18-speed drivetrain. Pair all that with the excellent fit and comfort of the Specialized Body Geometry saddle and grips, and you'll have a bike with the speed to back up its looks.",5.0,1350.0,10,Multi-Speed,http://thebicyclechain.com/images/library/large/specialized-sirrus-sport-carbon-263583-1.jpg
263563,2017 Specialized Vita Sport Carbon - Women's,"Conquering hills to get in shape, scouring your neighborhood for the perfect espresso, and even commuting to and from work are fun on Specialized's Vita Sport Carbon. Its lightweight, women's-specific carbon frame and fork deliver the perfect blend of speed and road-smoothing luxury. You'll love the easy-spinning wheels, and the lightning-quick shifts of the wide-range, hill-topping Shimano/microSHIFT drivetrain with FSA cranks. All that speed is easily controlled with powerful Shimano hydraulic disc brakes. Plus, the Specialized Body Geometry women's saddle and grips with integrated bar-ends provide outstanding comfort on every fun outing.",0.0,1350.0,12,Multi-Speed,http://thebicyclechain.com/images/library/large/specialized-vita-sport-carbon-263563-1.jpg
263788,2018 Specialized CruX E5,"Whether you're looking to race cyclocross or explore the dirt roads in your area, Specialized's CruX E5 is your willing accomplice. Its lightweight aluminum frame is full of cross-oriented touches like a shoulder-friendly top tube, internal cable routing to keep the muck out, and plenty of tire clearance. Up front, the FACT-carbon fork boasts a tapered steerer for precision handling, and it pairs nicely with the TRP Spyre disc brakes for confident, smooth braking. And for even more on/off-road versatility, the CruX is spec'd with light, smooth DT Swiss wheels, a smooth-shifting Shimano Tiagra drivetrain, and stiff FSA cranks.",5.0,1400.0,17,Cyclocross Bikes,http://thebicyclechain.com/images/library/large/specialized-crux-e5-263788-11.jpg
225260,2017 Specialized Fatboy SE,"Specialized Fatboy SE mixes fat bike fun with legendary Specialized performance. This value-packed behemoth delivers with a lightweight aluminum frame paired with an aluminum fork. All that rolls on 4.8-inch Ground Control tires that devour everything in your path. The super-wide aluminum rims give you stability and durability to roll through the rocky, root-filled trails like butter. It all gets going with SRAM's slick-shifting 2x10 X5 drivetrain while dependable Tektro Aires mechanical brakes rein it in. Finished out with an excellent Body Geometry saddle and grips, the Fatboy SE opens up a whole new world of rideable terrain.",5.0,1400.0,18,Unsuspended,http://thebicyclechain.com/images/library/large/specialized-fatboy-se-225260-1.jpg
302361,2018 Specialized Men's Diverge E5 Elite,"We're adamant believers that you needn't have an elitist's budget to feel like one. Need proof? Take a look at Specialized's Diverge E5 Elite. The Diverge frame will comfortably fit up to 700x42mm tires with plenty of room for mud, too. Weight was a large factor in the development, so Specialized took some design cues from the Roubaix with an E5 Premium Aluminum frame that's plenty light, certainly stiff for hard efforts, and undeniable durable. Specialized opted for a new Open Road Geometry. We know what you're thinking, ""it's just another marketing term,"" but they truly did develop an entirely new geometry. Think of it as a road version of modern trail bike geometry. It provides playful handling and predictable steering for endless dirt skids and mid-corner drifts. The geo features a bottom bracket that's over a half-centimeter lower than the previous Diverge, a slacked-out head tube angle, short chainstays, and a short wheelbase. These changes make for a bike that's not only fun in the dirt, but also performs well on the road. Specialized topped it off with three water bottle mounts and mounts for racks and fenders. So while it's one of the most smile-inducing bikes you'll ever shred fire roads on, it's equally adept at bike packing, commuting, or even a spin to your local brewery. The frame, meanwhile, is topped off with a Shimano Tiagra groupset, mechanical-disc brakes, and an Axis Sport wheelset.",0.0,1400.0,12,Multi-Speed,http://thebicyclechain.com/images/library/large/specialized-diverge-e5-elite-302361-11.jpg
263539,2017 Specialized Rockhopper Pro 29,"Glide over the trail and show roots and rocks who's boss with Specialized's Rockhopper Pro 29er. Its big wheels, svelte A1 SL aluminum frame and air-sprung RockShox suspension fork work together to turn techy sections into smooth highways of loamy dirt. Other legit touches found on this rig include the reliable Stout XC SL rims, a slick 2x10-speed Shimano/SRAM drivetrain and hydraulic Shimano disc brakes that stop on a dime while providing excellent speed modulation in even the nastiest conditions. And, you'll also dig the Specialized aluminum components and comfy Body Geometry saddle.",5.0,1400.0,19,Front-Suspension,http://thebicyclechain.com/images/library/large/specialized-rockhopper-pro-29-263539-11.jpg
302369,2018 Specialized Women's Diverge E5 Elite,"Made for exploring new roads, commuting to class, and everything in between, the Women's Diverge Comp E5 redefines how many functions one bike can fulfill. The Diverge frame will comfortably fit up to 700x42mm tires with plenty of room for mud, too. Weight was a large factor in the development, so Specialized took some design cues from the Roubaix with an E5 Premium Aluminum frame that's plenty light, certainly stiff for hard efforts, and undeniable durable. Specialized opted for a new Open Road Geometry. We know what you're thinking, ""it's just another marketing term,"" but they truly did develop an entirely new geometry. Think of it as a road version of modern trail bike geometry. It provides playful handling and predictable steering for endless dirt skids and mid-corner drifts. The geo features a bottom bracket that's over a half-centimeter lower than the previous Diverge, a slacked-out head tube angle, short chainstays, and a short wheelbase. These changes make for a bike that's not only fun in the dirt, but also performs well on the road. Specialized topped it off with three water bottle mounts and mounts for racks and fenders. So while it's one of the most smile-inducing bikes you'll ever shred fire roads on, it's equally adept at bike packing, commuting, or even a spin to your local brewery. For the spec, Specialized wanted to make sure that it shifted crisply and braked smoothly mile after mile, so you'll find a reliable Shimano Tiagra groupset, hassle-free mechanical disc brakes, and an Axis Sport Disc wheelset that's been cased in our Espoir Sport Reflect tires. Every touchpoint of the bike is also tailored specifically for women, from the handlebar width to the crankarm length to the renowned Myth Sport saddle.",0.0,1400.0,19,Multi-Speed,http://thebicyclechain.com/images/library/large/specialized-womens-diverge-e5-elite-302369-1.jpg
