sku,name,desc,rating,price,quantity,type,image
309327,2018 Cannondale SuperSix EVO Ultegra,"The SuperSix EVO spares no expense in its pursuit of well-rounded excellence. With its ultra-stiff, incredibly lightweight frame, and TAP Aero features, the SuperSix is a worthy competitor anywhere. This BallisTec carbon frame features Cannondale's Road Race geometry for a responsive and nimble ride in all handlebar positions. The SPEED SAVE fork eliminates all unnecessary weight while optimizing strength. With Shimano's 11-speed Ultegra drivetrain and smooth, powerful brakes, you'll gain unrivaled control on climbs, in corners, and on accelerations. Cannondale's aluminum stem, handlebar, and seatpost allow you to create the perfect position, and the Selle Royale saddle is the ultimate in svelte, all-day riding support.",0.0,2599.0,14,Sport/Performance,http://thebicyclechain.com/images/library/large/cannondale-supersix-evo-ultegra-309327-11.jpg
277948,2017 Cannondale Habit Carbon 3,"Replace a bad habit with this Habit Carbon 3 from Cannondale. Cannondale's Habit is composed and capable enough to run with bigger-travel bikes, yet light and lively enough to put the hurt on the shaved-leg set, delivering the most important kind of mountain bike performance — pure, simple, trail-ripping fun! This lightweight carbon frame features an aluminum swingarm for extra durability and a RockShox Monarch shock with 120mm of go-anywhere travel. A matching RockShox Pike fork offers another 120mm, so you can tackle rocks and roots with ease. WTB wheels are paired with Schwalbe tires and ensure nimble handling and confidence-inspiring grip. Shimano's 1x11-speed drivetrain and smooth, powerful Deore hydraulic disc brakes provide precise performance and control even in the most technical terrain, and a TransX dropper lets you stay in control, no matter what grade you're riding.",0.0,2686.0,15,Full-Suspension,http://thebicyclechain.com/images/library/large/cannondale-habit-carbon-al-3-277948-1.jpg
278009,2017 Cannondale Habit Women's Carbon 2,"With all-mountain capability and XC efficiency, the women's Habit is the perfect ""do-it-all-and-do-it-well"" mountain bike fun machine. This lightweight carbon frame features an aluminum swingarm for extra durability and a Fox Float DPS shock with 120mm of go-anywhere travel. A plush RockShox Pike fork offers another 120mm, so you can tackle rocks and roots with ease. 27.5-inch WTB Frequency wheels are paired with Schwalbe tires and ensure nimble handling and confidence-inspiring grip. Shimano's SLX/XT drivetrain shifts smoothly and easily, while powerful Deore hydraulic disc brakes are ready to slow things down when necessary. Add in the TransX dropper post, and you've got a super capable braap machine.",0.0,2686.0,16,Full-Suspension,http://thebicyclechain.com/images/library/large/cannondale-habit-womens-carbon-2-278009-1.jpg
309298,2018 Cannondale Habit 4,"With all-mountain capability and XC efficiency, Habit is the perfect “do-it-all, and do-it-well” MTB fun machine. This lightweight aluminum frame features a RockShox Monarch shock and 120mm of go-anywhere travel. A matching RockShox Revelation fork offers another 130mm, so you can tackle rocks and roots with ease. WTB wheels are paired with Schwalbe Nobby Nics and ensure nimble handling and confidence-inspiring grip. With a Shimano SLX drivetrain and powerful Deore hydraulic disc brakes, you'll get unquestionable performance on the trail. The TransX dropper post lets you crush the descents, and Cannondale supplies their lightweight aluminum handlebar, stem, and Stage 3 saddle for comfortable contact points.",0.0,2799.0,15,Full-Suspension,http://thebicyclechain.com/images/library/large/cannondale-habit-4-309298-1.jpg
309308,2018 Cannondale Quick NEO,"Cannondale makes it easy to stay in shape with their fitness e-bike, the Quick NEO. “What’s the point of a fitness e-bike,” you ask? “Don’t you need to pedal to get fit?” Well, we’ve all been out for a ride on a regular bike when suddenly there’s nothing left in the tank and every pedal stroke requires a huge effort. Remember how unpleasant it was to get home, how wiped out you were the next day? With Quick NEO’s Shimano STePS pedal assist, you can pedal all you want and go as far as like, knowing all the while you’ve got a helper to make sure you keep up the pace, make it up that hill, and get back home feeling great! Now, that’s what the “e-”in “fitness e-bike” does for you! The Quick NEO is the total package, with a lightweight, efficient aluminum frame and a suspension fork to knock down bumps and fatigue. A 10-speed Shimano drivetrain gives you gearing options galore, and powerful hydraulic disc brakes reliably usher you to a controlled stop. And, you’ll be comfortable all ride long thanks to Cannondale’s thoughtful and ergonomic touch points, including handlebar, grips, and saddle.",0.0,2799.0,16,Multi-Speed,http://thebicyclechain.com/images/library/large/cannondale-quick-neo-309308-1.jpg
309355,2018 Cannondale Quick NEO Women's,"Cannondale makes it easy to stay in shape with their fitness e-bike, the Quick NEO Women's. “What’s the point of a fitness e-bike,” you ask? “Don’t you need to pedal to get fit?” Well, we’ve all been out for a ride on a regular bike when suddenly there’s nothing left in the tank and every pedal stroke requires a huge effort. Remember how unpleasant it was to get home, how wiped out you were the next day? With Quick NEO’s Shimano STePS pedal assist, you can pedal all you want and go as far as like, knowing all the while you’ve got a helper to make sure you keep up the pace, make it up that hill, and get back home feeling great! Now, that’s what the “e-”in “fitness e-bike” does for you! The Quick NEO is the total package, with a lightweight, efficient aluminum step-through frame and a suspension fork to knock down bumps and fatigue. A 10-speed Shimano drivetrain gives you gearing options galore, and powerful hydraulic disc brakes reliably usher you to a controlled stop. And, you’ll be comfortable all ride long thanks to Cannondale’s thoughtful and ergonomic touch points, including handlebar, grips, and saddle.",0.0,2799.0,13,Multi-Speed,http://thebicyclechain.com/images/library/large/cannondale-quick-neo-womens-309355-1.jpg
309270,2018 Cannondale Scalpel-Si 5,"Kill on the ups and thrill on the downs with the world's best XC race machine. Welcome to XXC. Cannondale built their brand on aluminum frames and the Scalpel-Si showcases what they've learned along the way with low weight, out of the saddle stiffness, and snappy, responsive handling. 100mm of trail-smoothing travel is managed by a RockShox Monarch shock and Cannondale's Lefty 2.0 fork, a combo that chews up rocks and roots, transforming techy trail sections into a magic carpet ride. With Stan's NoTubes ZTR Crest rims and tubeless-ready Schwalbe tires, it doesn't matter if you're riding chunky gnar or buttery singletrack, they'll carve the turns and grip like nothing else. Cannondale Si cranks and a 2 x 11-speed SRAM/Shimano drivetrain offers a wide gear range, high-speed shifting, and rock-solid performance. Shimano Deore brakes are there when you need them, with power and modulation to spare. Cannondale components and a Prologo saddle round out the build and keep those contact points happy. Small: 27.5-inch wheelsMedium – X-Large: 29-inch wheels",0.0,2799.0,12,29-Inch Wheel (29ers),http://thebicyclechain.com/images/library/large/cannondale-scalpel-si-carbon-4-copy-259045-1.jpg
237340,2017 Cannondale Slate Force CX1,"Erase expectations on Cannondale's Slate Force CX1. Cannondale's unrivaled SmartFormed aluminum is lightweight, sports puma-like responsiveness, and—thanks to SAVE Plus micro-suspension and slack angles—handles a host of surfaces with panache. A Lefty Oliver fork breaks all the road-bike rules, adding 30mm of ride-anywhere suspension to your rig. Press the norm a little further with 650B Slate Disc wheels and fat, 42mm-wide Slate tires which give you the same rolling diameter of a traditional road wheel while providing all the plush, comfortable, and grippy benefits of a high volume tire. Throw the SRAM Force X1 levers to engage eleven crisp, quick-shifting gears, or apply the smooth, powerful SRAM Force hydraulic disc brakes to scrub speed. You'll love the weight savings from Cannondale's own C1 handlebars and stem, and a Fabric Scoop saddle provides compliance and support for the long haul. So, forget old ideas of what a road bike should be—the Slate will wipe them all away.",0.0,2899.0,15,Endurance/Gravel,http://thebicyclechain.com/images/library/large/cannondale-synapse-carbon-hi-mod-black-inc.-disc-womens-copy-237340-11.jpg
277949,2017 Cannondale Habit Carbon SE,"Cannondale's Habit Carbon SE is composed and capable enough to run with bigger-travel bikes, yet light and lively enough to put the hurt on the shaved-leg set. This lightweight carbon frame features an aluminum swingarm for extra durability and a RockShox Monarch shock with 120mm of go-anywhere travel. A matching RockShox Pike fork offers another 130mm, so you can tackle rocks and roots with ease. WTB Frequency wheels are paired with Schwalbe tires and ensure nimble handling and confidence-inspiring grip. With SRAM X1 shifting, Guide R hydraulic disc brakes, and a Fox dropper post, you'll find new levels of performance on the Habit. Wide bars, a short stem, and a Fabric saddle ensure dialed handling and comfortable contact points.",0.0,2985.0,11,Full-Suspension,http://thebicyclechain.com/images/library/large/cannondale-habit-carbon-al-se-277949-1.jpg
277979,2017 Cannondale SuperSix EVO Hi-MOD Disc Ultegra,"For the ultimate all-around race performance, the SuperSix EVO Disc strikes the perfect balance. Its unrivaled blend of stiffness, aerodynamics, low weight, and smooth-riding compliance gives you the winning edge on every part of the race course. For serious racers and enthusiasts looking to dominate the course, the Ballistec carbon frame provides stiffness and feather-light weight to help you grab podium spots, win town-line sprints, and reach the peaks of the highest climbs. An Ultegra hydraulic disc drivetrain provides Shimano's lauded 11-speed shifting and braking to send you smoothly down technical descents and quickly to the front of the peloton. Mavic wheels and Cannondale's HollowGram Si crank help you guide the power from your pedal stroke and down into the road, creating one of the fastest experiences on two wheels.",0.0,2985.0,11,Sport/Performance,http://thebicyclechain.com/images/library/large/cannondale-supersix-evo-hydraulic-disc-ultegra-277979-1.png
277970,2017 Cannondale SuperSix EVO Disc RED,"For the ultimate all-around race performance, the SuperSix EVO strikes the perfect balance. Its unrivaled blend of light weight, stiffness, aerodynamics and smooth-riding compliance gives you the winning edge on every part of the race course. With SRAM's celebrated RED drivetrain and powerful hydraulic disc brakes, you'll sail up the climbs and maintain perfect control in the corners and wet conditions. Cannondale supplies their own components for the sturdy, aluminum cockpit, while Fizik's Arione saddle is supportive, and sleek for long rides.",0.0,2999.0,13,Sport/Performance,http://thebicyclechain.com/images/library/large/cannondale-supersix-evo-disc-red-277970-1.jpg
297847,2018 Cannondale SuperX Apex 1,"Whether it's a dedicated cyclocross race rig or a B-road brawler, the SuperX Apex 1 cleans the paths less traveled with ease. With unmatched traction, massive mud clearance, and confidently stable “stick-any-line” handling, SuperX lets you go full gas from the start! The SuperX delivers stability and traction better than anything else on the market, making it the perfect cyclocross weapon. The ultra-low weight, stiffness, and smooth ride of the BallisTec carbon frame are just icing on the cake. Sturdy CX 2.0 rims wrapped in Schwalbe X-One tubeless tires let you float through mud and sand and shoot across flats. And, with a reliable SRAM Apex 1 drivetrain, as well as powerful SRAM Apex hydraulic disc brakes, you'll crush off-camber corners and trounce tricky sections, while Cannondale's awesome components create a winning position.",0.0,2999.0,18,Cyclocross Bikes,http://thebicyclechain.com/images/library/large/cannondale-superx-apex-1-297847-1.jpg
305203,2018 Cannondale Synapse Carbon Disc Ultegra,"The Cannondale Synapse Disc Ultegra is the ultimate machine for full-gas, full-day exploits. It's performance-focused, but with a slightly more upright position for comfort—perfect for long days in the saddle and confident handling on all road surfaces. The BallisTec carbon frame weighs in at a mere 950 grams, with a racy snap and sublime feel. An asymmetrically fork balances disc loads to deliver World Tour sprinter-level stiffness. Cannondale's SAVE frame technology tunes out harsh choppy road surfaces and tunes you in to what's happening at your tires, so you can concentrate on nailing the right line or beating the sun home. And with room for tires as big as 32mm, you can embrace the back roads, rough roads, highways and byways.   You’ll be rolling on Mavic Aksium wheels, known for their smooth-spinning strength and minimal weight. And, with Shimano's smooth-shifting workhorse Ultegra drivetrain, you'll find the gear you need every time. This reliable transmission has the range to scale any climb; while Ultegra hydraulic disc brakes offer confidence-inspiring power and smooth modulation, so you can push your limits a little bit further. Cannondale's C3 aluminum components and a Selle Royal Seta S1 saddle round out this distinctly high-class machine.",0.0,2999.0,16,Sport/Performance,http://thebicyclechain.com/images/library/large/cannondale-synapse-carbon-disc-ultegra-se-305203-11.jpg
305202,2018 Cannondale Synapse Carbon Disc Women's Ultegra,"The Cannondale Women's Synapse Carbon Disc Ultegra is the ultimate machine for full-gas, full-day exploits. It's performance-focused, but with a slightly more upright position for comfort—perfect for long days in the saddle and confident handling on all road surfaces. The lightweight BallisTec carbon frame offers a racy snap and sublime feel. An asymmetrically designed frame and fork balance pedaling and disc loads to deliver World Tour sprinter-level stiffness. Cannondale's SAVE frame technology tunes out harsh choppy road surfaces and tunes you in to what's happening at your tires, so you can concentrate on nailing the right line or beating the sun home. And with room for tires as big as 32mm, you can embrace the back roads, rough roads, highways and byways. You’ll be rolling on Mavic Aksium wheels known for delivering smooth-spinning strength with minimal weight. And, with Shimano's workhorse Ultegra drivetrain, you'll easily find the gear you need every time. Ultegra hydraulic disc brakes offer confidence-inspiring power and smooth modulation, so you can push your limits a little bit further. Cannondale's C3 aluminum components and a Selle Royal Seta S1 Women's saddle round out this distinctly high-class machine.",0.0,2999.0,12,Sport/Performance,http://thebicyclechain.com/images/library/large/cannondale-synapse-carbon-disc-womens-ultegra-305202-1.jpg
309293,2018 Cannondale F-Si Carbon 3,"The F-Si Carbon 3 is a lightning bolt on the race course. Designed to let you out-kick them on the climbs and out-rip them on the descents, this ultralight rocket is your ticket to the top of the podium. Equipped with the Lefty fork, you'll out-corner, out-steer, and out-handle the competition, again and again. Get insane traction with super short chainstays, without being limited to 1X set-ups, or sacrificing mud clearance. Cannondale also equips the F-Si with fit-focused wheel diameters, to achieve the best possible fit for all riders. With Shimano XT/SLX shifting, and Magura MT-RACE hydraulic braking, you'll race uphill and carve back down with expert precision. A Cannondale bar, super durable Stan's Crest MK3 rims, and tacky Schwalbe Racing Ralph EVO tires create a slick, race-ready hardtail package that's undeniable and distinctive both on the trail and off.",0.0,3199.0,16,Front-Suspension,http://thebicyclechain.com/images/library/large/cannondale-f-si-carbon-3-309293-1.png
309289,2018 Cannondale Fat CAAD 1,"Looking for a fatbike without all the fat? Lightweight construction and nimble OutFront geometry make the FAT CAAD so agile and quick, you’ll want to ride it all year long. This monster truck brings it with a SmartFormed aluminum frame for a stiff, responsive ride that's also trim on weight, while Cannondale's Lefty Olaf fork brings 100mm of travel to the table. Tubeless-ready Sun Ringle rims roll with confidence-swelling strength, and Schwalbe tires conform to practically any terrain with flotation and traction. A Shimano XT/SLX drivetrain gives you an 11-speed setup that goes up as well as it goes down, and SRAM Guide brakes are just what you need to bring the action to a swift, modulated stop. Cannondale supplies their lightweight handlebars, stem, and a Fabric Scoop saddle so you can comfortably ride this smash-ready bike almost anywhere in any season.",5.0,3199.0,16,Front-Suspension,http://thebicyclechain.com/images/library/large/cannondale-fat-caad-1-309289-1.jpg
291786,2018 Cannondale Jekyll 4,"When you’re on the Jekyll 4 from Cannondale, nothing dares get in your way. That’s because Jekyll’s tough aluminum frame shrugs off enduro brutality and arrives at the bottom begging to do it again and again. And you will, too, with 165mm of Fox DPS EVOL-guided travel in back and 170mm more up front, courtesy of Fox’s stiff, enduro-loving Float 36 fork. Together, they make easy work of gnarly descents where the only break you get is the climb back up. Since we’re talking about climbing, the Jekyll is no slouch in the uphill department, either, with a switch-on-the-fly rear suspension that offers Hustle Mode for tenacious efficiency. Put the power to the Shimano SLX drivetrain via Cannondale’s Si crankset, and you’ll gain elevation as fast as you drop the competition. And, for all-mountain dominance, you won’t find better rubber than the Jekyll’s Maxxis Minions, wrapped around 29mm WTB STP rims, well-known as workhorse hoops that’ll bail you out of your risky moves straight as an arrow. Shimano also provides powerful hydraulic brakes that keep you on course, even when that course can only be described as “sketchy.” So, jump on, slam the TransX dropper post, and flow this trail beast straight to victory.",5.0,3199.0,12,Full-Suspension,http://thebicyclechain.com/images/library/large/cannondale-jekyll-aluminum-4-291786-1.jpg
277920,2017 Cannondale Tandem 29er,"Cannondale Tandems have always been revered among the two-up crowd for their low weight, durability, and precise, flex-free handling. So grab a partner and enjoy the ride. Whether powering up a climb or carving an alpine descent, the Cannondale Tandem's flex-free handling and light weight make two-up riding a joy. With their proprietary SmartForm aluminum tubing, Cannondale achieves a combination of exceptional stiffness and super low weight. With stout but svelte 29er rims and powerful Magura disc brakes, you'll achieve excellent performance no matter what the terrain, and a precise-shifting Shimano drivetrain will ensure you make it over those peaks in the distance. Live stoked.",0.0,3199.0,10,Tandem,http://thebicyclechain.com/images/library/large/cannondale-tande29er-277920-1.jpg
211926,2016 Cannondale Tandem 29,"Share the off-road fun on Cannondale's Tandem 29. You and your partner can get stoked on trails with the burly aluminum frame that offers smooth riding and confidence-inspiring handling on any terrain. 29-inch wheels from DT Swiss clear obstacles easily and keep you rolling fast on fire roads and singletrack. This trail tandem sports a smooth-shifting, hill-conquering, 30-speed Shimano/SRAM drivetrain and powerful Magura hydraulic brakes. So go ahead and take the road less traveled. Only this time, bring a friend.",5.0,3200.0,17,Tandem,http://thebicyclechain.com/images/library/large/cannondale-tandem-29-copy-211926-1.jpg
277986,2017 Cannondale Bad Habit Carbon 2,"For once, develop a Bad Habit that won't require an appearance on Intervention. Take to your favorite trail on Cannondale's Bad Habit Carbon 2 and wreak havoc with the carbon frame and alloy swingarm combo. The Bad Habit takes the characteristics of the Habit and supercharges them with 27.5+ wheels to create the ultimate technical trail machine. Huge grip, awesome roll-over-anything float from the 3-inch tires, and a wicked component package make this Bad Habit one that will be tough to shake. You'll love the stiffer 148 x 12 mm rear hub, the super strong Lefty fork, and the innovative OutFront Steering geometry.",0.0,3283.0,17,Full-Suspension,http://thebicyclechain.com/images/library/large/cannondale-bad-habit-carbon-2-dgr-277986-1.jpg
309323,2018 Cannondale Bad Habit 3,"This Bad Habit will definitely die hard once you've sampled its all-mountain prowess. 27.5+ tires give the old Habit a bad boy attitude, upping its all-terrain game for maximum fun on steep, loose, and gnarly trails. The SmartForm alloy frame creates the point-and-shoot feel you want for technical maneuvers, and powerful Shimano Deore brakes put mind-bending control in your fingertips. Shimano XT and SLX shifting components paired with Cannondale's Si crankset ensure quick shifts through the 1 x 11 system, giving you the confidence to charge through whatever lies ahead. All this forward momentum is kept in check through 120mm of front and rear suspension, with a RockShox Pike RC fork and Fox Float DPS Performance EVOL SV to further aid in the crazy amount of traction plus-size tires provide. A TranzX dropper seatpost, WTB STP i23 rims, and Cannondale alloy handlebar create an irresistible Bad Habit you won't want to drop.",0.0,3299.0,11,Full-Suspension,http://thebicyclechain.com/images/library/large/cannondale-bad-habit-3-309323-1.jpg
277947,2017 Cannondale Habit Carbon 2,"Cannondale's Habit is composed and capable enough to run with bigger-travel bikes, yet light and lively enough to put the hurt on the shaved-leg set. The lightweight carbon frame features an aluminum swingarm for extra durability, and 120mm of go-anywhere travel. Cannondale's Lefty 2.0 OPI fork offers another 120mm so you can tackle rocks and roots with ease. Stan's Arch wheels are paired with Schwalbe Nobby Nics and ensure nimble handling and confidence-inspiring grip. With an awesome XTR/XT drivetrain and powerful Shimano XT hydraulic disc brakes, you'll have incredible performance right at your fingertips, and a Fox dropper post gives you the proper position both uphill and bombing back down.",0.0,3432.0,16,Full-Suspension,http://thebicyclechain.com/images/library/large/cannondale-habit-carbon-al-2-277947-1.jpg
278008,2017 Cannondale Habit Women’s Carbon 1,"Light and efficient fun on XC trails but capable enough to rip it up in big travel terrain, the women's Habit is your up-for-anything, sweet-handling, smile-inducing, shred-ready trail companion. If you're looking for one bike to do it all, make it a Habit. This lightweight carbon frame features an aluminum swingarm for extra durability and a RockShox Monarch DebonAir XX shock with 120mm of go-anywhere travel. Cannondale's light and supple Lefty 2.0 fork offers another 120mm, so you can tackle rocks and roots with ease. 27.5-inch Stan's Arch EX wheels are paired with Schwalbe tires for nimble handling and confidence-inspiring grip. You'll love Shimano's XTR/XT 1x11-speed drivetrain and the smooth, powerful stopping power from the XT brakes. Add in a Fox dropper post and wide carbon bars, and you've got a new fix to feed.",0.0,3432.0,10,Full-Suspension,http://thebicyclechain.com/images/library/large/cannondale-habit-carbon-al-1-278008-1.jpg
309288,2018 Cannondale Cujo NEO 2,"Whatever the trail has in store, Cujo rips it, and asks for more. With huge 27+ tires, confident geometry, and power to spare, it will up your game on even the rockiest, nastiest terrain. The Shimano Steps E8000 system provides true mountain bike performance with perfect access to controls and an easy-to-read display. And Cujo’s 27+ wheels combine wide rims with full 2.8-inch tires for unreal traction and cushioned float on just about any surface the trail can throw your way. A 10-speed transmission keeps you in the flow with a wide range of gears and quick shifting, while Tektro hydraulic disc brakes enable confident control on the steepest descents. Cannondale tops the build with its own handlebar, stem, and saddle.",0.0,3499.0,10,Front-Suspension,http://thebicyclechain.com/images/library/large/cannondale-cujo-neo-2-309288-1.jpg
277939,2017 Cannondale F-Si Carbon 2,"The F-Si Carbon 2 is a hardtail like no other. Designed to let you out-kick them on the climbs and out-rip them on the descents, this ultralight rocket is your ticket to the top of the podium. Equipped with the Lefty fork, you'll out-corner, out-steer, and out-handle the competition, again and again. Get insane traction with super short chainstays, without being limited to 1X set-ups, or sacrificing mud clearance. Cannondale also equips the F-Si with fit-focused wheel diameters, to achieve the best possible fit for all riders. With Shimano XT/XTR shifting, and Magura hydraulic braking, you'll race uphill and carve back down with expert precision. A carbon Cannondale bar, super fast CZero carbon rims, and tacky Schwalbe Racing Ralph tires create a slick, race-ready hardtail package that's undeniable and distinctive both on the trail and off.",5.0,3499.0,19,29-Inch Wheel (29ers),http://thebicyclechain.com/images/library/large/cannondale-f-si-carbon-2-277939-11.jpg
