sku,name,desc,rating,price,quantity,type,image
273842,2018 Specialized Riprock Coaster 16,"Specialized's Riprock Coaster 16 packs big-time fun into a pint-sized package. This great bike features a lightweight aluminum frame and fork that will withstand the bumps and jumps of neighborhood riding. With a comfortable saddle, wide tires, coaster brake and confidence-boosting training wheels, this bike is a joy to ride and sturdy enough to pass down to a little sibling, too.",0.0,240.0,16,16-Inch (3-6 yr. old),http://thebicyclechain.com/images/library/large/specialized-riprock-coaster-16-273842-15.jpg
172539,2016/2017 Specialized Boy's Hotrock 20 Coaster,"Specialized's Boy's Hotrock 20 Coaster is an easy way for little kids to step up to big-time fun. It features an aluminum frame built to withstand the rigors of childhood bike riding and a rear hand brake to get him ready for bigger bikes down the road, while the coaster brake provides a familiar backup to facilitate the learning process. Plus, the Hotrock comes with fat, knobby tires for serious traction on all types of terrain.",5.0,250.0,19,20-Inch (5-8 yr. old),http://thebicyclechain.com/images/library/large/b4e0_36_hot_20_cstr_boy_blk_wht_blu_spzld_13_z.jpg
273843,2018 Specialized Riprock Coaster 20,"Specialized's Riprock Coaster 20 packs big-time fun into a pint-sized package. This great bike features a lightweight aluminum frame and fork that will withstand the bumps and jumps of neighborhood riding. With a comfortable saddle, 20-inch tires, and coaster brake, your little one will be able to rip and ride on any terrain that they come across.",0.0,250.0,13,20-Inch (5-8 yr. old),http://thebicyclechain.com/images/library/large/specialized-riprock-cstr-20-273843-14.jpg
172588,2017 Specialized Boy's Hotrock 20 (6-Speed),"Someone has to have the coolest bike on the block; it might as well be your budding cycling superstar. Specialized's Boy's Hotrock 20 boasts a super-strong aluminum frame built to handle all the bumps and jumps junior can dish out and a cool suspension fork sure to draw admiring glances and provide hours of fun. Other noteworthy goodies include a Shimano 6-speed drivetrain with an easy-to-use twist shifter, grippy linear-pull brakes with levers made for small hands and a chainguide that keeps the chain in place.",5.0,360.0,13,20-Inch (5-8 yr. old),http://thebicyclechain.com/images/library/large/b4e0_41_hot_20_6spd_boy_blu_wht_blk_spzld_13_z.jpg
273000,2017 Specialized Girl's Hotrock 20 (6-Speed),"Someone has to have the coolest bike on the block, it might as well be your little cycling superstar. Specialized's Girl's Hotrock 20 boasts a super-strong aluminum frame built to handle all the bumps and jumps she can dish out and a cool suspension fork sure to draw admiring glances and provide hours of fun. Other noteworthy goodies include a Shimano 6-speed drivetrain with an easy-to-use twist shifter, grippy linear-pull brakes with levers made for small hands and a chainguide that keeps the chain in place.",5.0,360.0,17,20-Inch (5-8 yr. old),http://thebicyclechain.com/images/library/large/spec_hotrock_20_6spd_girl_pnk_13_z.jpg
306088,2018 Specialized Hotrock 20,"Your little tike might love to ride, but given that they're still growing like a weed, the big-kid-trail-shredder bike can probably wait a few years. That's why Specialized made their Hotrock 20 with plenty of gear range to tackle the neighborhood hills, and enough front end travel to ride beginner's trails confidently. Of course, it also features a lightweight, yet durable, 20-inch A1 Premium Aluminum frame that's designed to take a hit while they find their legs on the pump track. Chatter and bumps, meanwhile, are handled by the coil-sprung SR Suntour fork's 50mm of travel. Then there are a whole host of other components that are plenty tough enough to stand up to your little ripper, so you can rest assured that you'll be spending more time riding with your kid and less time waiting in line at the repair counter. - Tough, light, and durable, the A1 Premium Aluminum frame is built to stand up to years of tough riding.- SR Suntour suspension fork offers 50mm of coil-sprung travel that smooths out bumpy, rough terrain.- The 7-speed Shimano Tourney shifts smoothly and is tough enough for abuse.",0.0,360.0,15,20-Inch (5-8 yr. old),http://thebicyclechain.com/images/library/large/specialized-hotrock-20-306088-1.jpg
172602,2016/2017 Specialized Boy's Hotrock 24 (7-Speed),"Your 24/7 ball of energy can tackle any terrain with ease on Specialized's Boy's Hotrock 24! This cool ride features an agile and durable aluminum frame, a terrain-tackling SR SunTour suspension fork, an easy-to-pedal 7-speed Shimano drivetrain and reliable Specialized components. Plus, it features linear-pull brakes for easy, confident stops.",5.0,380.0,16,24-Inch (7+ yr. old),http://thebicyclechain.com/images/library/large/b4e0_66_hot_24_7spd_boy_blk_red_wht_spzld_13_z.jpg
172599,2016/2017 Specialized Girl's Hotrock 24 (7-Speed),"Your 24/7 ball of energy can tackle any terrain with ease on Specialized's Girl's Hotrock 24! This cool ride features an agile and durable aluminum frame, a terrain-tackling SR SunTour suspension fork, an easy-to-pedal 7-speed Shimano drivetrain and reliable Specialized components. Plus, it features linear-pull brakes for easy, confident stops.",5.0,380.0,18,24-Inch (7+ yr. old),http://thebicyclechain.com/images/library/large/b4e0_67_hot_24_7spd_girl_pur_pnk_spzld_13_z.jpg
306096,2018 Specialized Hotrock 24,"Your little one might love to ride, but that doesn't mean they'll be doing Trans-Provence this summer. That's why Specialized made their Hotrock 24 with plenty of gear range to tackle the neighborhood hills, and enough front end travel to ride beginner's trails confidently. Of course, it also features a lightweight, yet durable, A1 Premium Aluminum frame that's designed to take a hit while they find their legs on the pump track. Chatter and bumps, meanwhile, are handled by the coil-sprung SR Suntour fork's 50mm of travel. Then there are a whole host of other components that are plenty tough enough to stand up to your little ripper, so you can rest assured that you'll be spending more time riding with your kid and less time waiting in line at the repair counter. - Tough, light, and durable, the A1 Premium Aluminum frame is built to stand up to years of tough riding.- SR Suntour suspension fork offers 50mm of coil-sprung travel that smooths out bumpy, rough terrain.- The 8-speed Shimano Tourney shifts smoothly and is tough enough for abuse.",0.0,380.0,18,24-Inch (7+ yr. old),http://thebicyclechain.com/images/library/large/specialized-hotrock-24-306096-1.jpg
172628,2017 Specialized Girl's Hotrock 24 Street (21-Speed),"Riding around the neighborhood and to school is easier and more fun on Specialized's Girl's Hotrock 24 Street. Its aluminum frame and fork are light and efficient. They're paired with fast-rolling semi-slick Specialized tires on 24-inch wheels so your young rider will be able to go faster with less effort. Plus, she'll love the twist shifters and easy-pedaling 21-speed drivetrain that's perfect for scaling the neighborhood's toughest inclines and tagging along with you!",0.0,410.0,17,24-Inch (7+ yr. old),http://thebicyclechain.com/images/library/large/b4e0_81_hot_24_21spd_st_girl_blk_pnk_spzld_13_z.jpg
172620,2017 Specialized Boy's Hotrock 24 (21-Speed),"Specialized's Boy's Hotrock 24 is a fun ride that's perfect for off-road exploration and urban adventure. Its aluminum frame is light and super fast, while the SR SunTour fork smooths out impacts and improves control in rough conditions. Plus, he'll love the twist shifters and easy-pedaling 21-speed drivetrain that's perfect for scaling the neighborhood's toughest inclines. And for awesome control, the Boy's Hotrock has sure-stopping linear-pull brakes and grippy Specialized tires, too.",4.0,420.0,11,24-Inch (7+ yr. old),http://thebicyclechain.com/images/library/large/b4e0_71_hot_24_21spd_boy_blk_wht_cyn_spzld_13_z.jpg
273017,2016 Specialized Girl's Hotrock 24 (21-Speed),"Specialized's Girl's Hotrock 24 is a fun ride that's perfect for off-road exploration and urban adventure. Its aluminum frame is light and super fast, while the SR SunTour fork smooths out impacts and improves control in rough conditions. Plus, she'll love the twist shifters and easy-pedaling 21-speed drivetrain that's perfect for scaling the neighborhood's toughest inclines. And for awesome control, the Hotrock has sure-stopping linear-pull brakes and grippy Specialized tires, too.",5.0,420.0,13,24-Inch (7+ yr. old),http://thebicyclechain.com/images/library/large/b4e0_77_hot_24_21spd_girl_pur_wht_spzld_13_z.jpg
263973,2017 Specialized Rockhopper 29,"Specialized's Rockhopper 29er opens up a whole new world of mountain biking adventure. Its light, agile A1 butted-aluminum frame teams up with a terrain-smoothing Suntour suspension fork and big 29-inch wheels to sail over tricky terrain and keep you pedaling strong. The fun continues with trail-ready components like a 24-speed Shimano drivetrain, powerful Shimano mechanical discs and grippy Specialized tires. You also get Specialized's ergonomic Body Geometry grips and saddle for long-ride comfort on all your adventures.",5.0,420.0,10,29-Inch Wheel (29ers),http://thebicyclechain.com/images/library/large/specialized-rockhopper-29-263973-1.jpg
311749,2018 Specialized Men's Sirrus Alloy - V-Brake,"If you're going to get in shape, you need to move, and nothing wants to help you move faster than our Sirrus with hassle-free V-brakes. It takes a no- nonsense approach to its design, giving you everything that you need and nothing that you don't. It's constructed from a durable, reliable, and lightweight A1 Premium Aluminum, and it features a reliable set of components that are built to withstand years of daily abuse, like comforting Body Geometry touch points that are sure to take the sting out of long rides. You'll also find rack and fender mounts, so lugging your stuff around town just got a whole lot easier. Complacency just met its match. - Working with our Body Geometry team, we designed a frame that strikes the optimal balance between comfort and efficiency. The A1 Premium Aluminum construction is plenty durable, while the rack, fender, and disc mounts give you an incredibly versatile package.- A steel, straight blade fork provides a responsive ride, while the fender and rack mounts give you the option to install rain-fighting fenders and racks that can transport your gear around town.- V-brakes are dependable and easy to maintain, so you won't have to worry about brake bleeds or labor-intensive maintenance to have awesome stopping power.",0.0,430.0,19,Multi-Speed,http://thebicyclechain.com/images/library/large/specialized-mens-sirrus-alloy-v-brake-311749-12.jpg
311763,2018 Specialized Women's Sirrus - V-Brake,"Getting fit is hard enough without emptying every last cent in your wallet for the tools to do it with. Never fear, though, because our Women's Sirrus was designed to be your partner in all things fitness at a price that won't leave you broke and hungry. It's constructed from a durable, reliable, and lightweight A1 Premium Aluminum, and it features a reliable set of components that are built to withstand years of daily abuse, hassle-free V-brakes, and comforting Women's Body Geometry touch points that are sure to take the sting out of long rides. Go on—put it to work. - Working with our Body Geometry team, we designed a frame that strikes the optimal balance between comfort and efficiency. The A1 Premium Aluminum construction is plenty durable, while the rack, fender, and disc mounts give you an incredibly versatile package.- A steel, straight blade fork provides a responsive ride, while the fender and rack mounts give you the option to install rain-fighting fenders and racks that can transport your gear around town.- V-brakes are dependable and easy to maintain, so you won't have to worry about brake bleeds or labor-intensive maintenance to have awesome stopping power.",0.0,430.0,19,Multi-Speed,http://thebicyclechain.com/images/library/large/specialized-womens-sirrus-v-brake-311763-12.jpg
225303,2018 Specialized Crossroads,"Here's the road to a fit, healthy lifestyle. Specialized's Crossroads is stable and fun. It sports a laid-back aluminum frame, road-smoothing steel fork, and an upright riding position for ultra-relaxed pedaling, while the fast-rolling, road bike size wheels carry you across town or down to the park with ease. The 21-speed Shimano drivetrain and linear-pull brakes provide easy, precise shifting and confidence-inspiring control. The Crossroads also boasts multi-surface capable tires, Body Geometry grips, and an incredibly comfortable seat.",5.0,440.0,18,Specialized,http://thebicyclechain.com/images/library/large/specialized-crossroads-225303-1.jpg
225307,2018 Specialized Crossroads Step-Through - Women's,"Here's the road to a fit, healthy lifestyle. Specialized's Crossroads is stable and fun. It sports a laid-back aluminum frame, road-smoothing steel fork, and an upright riding position for ultra-relaxed pedaling, while the fast-rolling, road bike size wheels carry you across town or down to the park with ease. The 21-speed Shimano drivetrain and linear-pull brakes provide easy, precise shifting and confidence-inspiring control. The Crossroads also boasts multi-surface capable tires, Body Geometry grips, and an incredibly comfortable seat.",4.0,440.0,10,Specialized,http://thebicyclechain.com/images/library/large/specialized-crossroads-step-through-womens-225307-1.jpg
263532,2017 Specialized Crosstrail,"Can't decide between the road and bike trails? No worries. Ride both with Specialized's Crosstrail. It eats up both dirt and pavement thanks to its great-handling Specialized A1 Premium aluminum frame, a bump-bustin' custom suspension fork with a lockout feature for fast and efficient use over any surface, and smooth-rolling 700c wheels. You'll also love the easy-pedaling Shimano 24-speed drivetrain and the powerful linear-pull brakes. And to make your rides even smoother, the Crosstrail boasts a ergonomic Specialized Body Geometry seat.",5.0,440.0,18,Specialized,http://thebicyclechain.com/images/library/large/specialized-ct-rim-263532-1.jpg
210485,2015/2016 Specialized Expedition,"Trips to the store, short afternoon spins and commutes to work, Specialized's Expedition does it all. You'll love its upright, easy-on-the-back riding position, the lightweight aluminum frame and the plush suspension fork that smooths out all the bumps for maximum comfort and control. To keep you rolling, the Expedition's aluminum rims spin free and easy, while the 7-speed Shimano drivetrain provides simple, low-maintenance operation. Other fine touches include a riser handlebar, flat-resistant tires and a luxuriously comfortable Specialized saddle.",5.0,440.0,11,Specialized,http://thebicyclechain.com/images/library/large/specialized-expedition-210485-1.jpg
263514,2017 Specialized Hardrock 650b,"Specialized takes entry level to the next level with the Hardrock 650b. Crafted from their A1 Premium aluminum, the frame is light, durable and nimble, while the SR Suntour fork serves up 75mm of bump-busting travel. Its tough 650b aluminum rims are ready for years of commuting and singletrack riding, and the Shimano 21-speed drivetrain makes hills doable. Plus, the Hardrock comes with powerful linear-pull brakes and a suite of low-maintenance Specialized components, including a supportive Body Geometry saddle.",5.0,440.0,14,Front-Suspension,http://thebicyclechain.com/images/library/large/specialized-hardrock-v-650b-263514-1.jpg
263531,2017 Specialized Myka 650b - Women's,"Specialized's Myka is an excellent all-around mountain bike made just for you. Its lightweight aluminum frame is fun to ride and features women's-specific geometry for a perfect fit, total control, and maximum confidence. This sweet machine boasts sturdy aluminum 650b wheels and an SR Suntour suspension fork for comfort and precision handling. And, it's equipped with an easy-pedaling Shimano 21-speed drivetrain that lets you cruise over the hills, plus linear-pull brakes for top-notch stopping power.",0.0,440.0,19,Front-Suspension,http://thebicyclechain.com/images/library/large/specialized-myka-650b-263531-1.jpg
304577,2018 Specialized Men's Pitch 27.5,"You've thought about it—probably even got out on the dirt or gravel a few times—and now's the time to pull the trigger on a fully-fledged mountain bike. Well, you're in the right place. The Pitch 27.5 features everything you need to start getting off the road and out on some trails. It features a light aluminum frame that's equal parts performance-driven and durable, while all of the components have been mindfully selected for their capability and long term strength. And when you factor in a geometry that's going to leave you feeling confident and ready to get after it, it's safe to say that the Pitch is the perfect starting point for your life of playing in the dirt. - The frame is constructed from lightweight A1 Premium Aluminum in order to provide a compliant, durable platform to support our acclaimed Sport Trail 27.5 Geometry. Combined, you get a bike that's extremely versatile, making it equally capable on the climbs and descents. - Custom SR Suntour XCT fork features 80/100mm (size-specific) of coil-sprung suspension travel that swings well above its weight class. - A Shimano TX800 rear derailleur is built to with durability in mind, so you can rest assured that you'll have a reliable shifting partner for the long trails ahead.",0.0,450.0,16,Front-Suspension,http://thebicyclechain.com/images/library/large/specialized-mens-pitch-27.5-304577-1.jpg
247876,2018 Specialized Riprock 20,"Riding bikes is all about having fun, especially when you're a kid! Which is why Specialized made the Riprock 20 a bike that any of us would have drooled over as a little one. The A1 Premium Aluminum frame is lightweight and built to withstand the tough use doled out by kids, while the geometry features an ultra-low standover that makes it easy for your little ones to fit on the bike. A Custom SR Suntour XCT fork provides 60mm of bump-busting travel, while Shimano's Revoshift is uncomplicated and intuitive for kids to use. Watch them fly up hills with the Shimano 7-speed drivetrain and stay in control on the way back down thanks to the Tektro Aries disc brakes, which are easy for little hands to reach and deliver ample stopping power. Super wide tires wrapped around 20-inch aluminum wheels deliver heaps of traction, comfort, and stability and ensure that the Riprock is approved for fun anywhere.",0.0,450.0,14,Front-Suspension,http://thebicyclechain.com/images/library/large/specialized-riprock-20-247876-13.jpg
304581,2018 Specialized Women's Pitch 27.5,"We've all felt the compulsion to break free from our day-to-day routine, especially when it comes to riding. Sure, laps around town are fun, but compared to the freedom of getting out in the woods or on country roads, life on the pavement starts to look pretty mundane. Lucky for you, our Women's Pitch 27.5 unlocks the potential of your ride. With a light aluminum frame and our Women's Sport Trail 27.5 Geometry, you'll be feeling comfortable and confident regardless of the terrain. And with corrosion-resistant hardware and kickstand compatibility, this Pitch provides the long-term durability and ease-of-use that every bike should strive for. Question is—where will you take it? - The frame is constructed from lightweight A1 Premium Aluminum in order to provide a compliant, durable platform to support our acclaimed Women's Sport Trail 27.5 Geometry. Combined, you get a bike that's extremely versatile, making it equally capable on the climbs and descents. - Custom SR Suntour XCT fork features 80/100mm (size-specific) of coil-sprung suspension travel that swings well above its weight class. - A Shimano TX800 rear derailleur is built to with durability in mind, so you can rest assured that you'll have a reliable shifting partner for the long trails ahead.",0.0,450.0,14,Front-Suspension,http://thebicyclechain.com/images/library/large/specialized-womens-pitch-27.5-304581-1.jpg
273002,2017 Specialized Girl's Hotrock 24 XC,"Specialized's Girl's Hotrock 24 XC is a great way for your child to join you on your mountain biking forays. It features Specialized's A1 Premium aluminum frame that's light and nimble on the trail and around the neighborhood. Up front, a suspension fork handles the bumps and increases steering control. Plus, the 21-speed drivetrain delivers climb-conquering gears, while the linear-pull brakes quickly and safely bring her to a stop.",0.0,470.0,12,24-Inch (7+ yr. old),http://thebicyclechain.com/images/library/large/specialized-htrk-24-xc-girl-273002-1.jpg
273433,2018 Specialized Alibi,"How many times have you been ready to ride, only to be confronted with a flat tire? Well, Specialized's Alibi wants you to be pumped up to ride, not pumping up your tires. That's why it comes with tires that don't need any air at all. That's right, you can kiss your pump goodbye, and more importantly, you can say goodbye to ever having a flat tire again. They also designed an anti-rust chain for this bike that removes the need for regular dirty, grimy maintenance, plus a super comfortable Body Geometry saddle and grips that are 100% designed for women. The Alibi is always ready to ride, so consider it the perfect partner on your path to a fitter, better you. - The hard-working, sturdy A1 Premium Aluminum frame is light and durable, and it also features rack and fender mounts for easy portage and dry riding in wet conditions. You'll also find that it's engineered with Specialized's Fitness Geometry, meaning that you’ll go fast with maximum efficiency, but without the discomfort of an aggressive ride position. After all, the more comfortable you are, the longer you’ll ride.- The Alibi’s anti-rust chain keeps rolling smoothly, even after a couple of confrontations with the elements, so you can spend more time riding and less time fixing.- There’s never a good time for a puncture, which is why the Nimbus Airless tires feature a puncture-proof core, offering incredible traction without the hassle of changing a tube.- Gender: Women's",0.0,475.0,17,Multi-Speed,http://thebicyclechain.com/images/library/large/specialized-alibi-273433-11.jpg
273434,2018 Specialized Alibi Step-Through,"How many times have you been ready to ride, only to be confronted with a flat tire? Well, Specialized's Alibi Step Through wants you to be pumped up to ride, not pumping up your tires. That's why it comes with tires that don't need any air at all. That's right, you can kiss your pump goodbye, and more importantly, you can say goodbye to ever having a flat tire again. This version of the Alibi also comes with a step through design that makes getting on and off the bike as easy as can be, an anti-rust chain that removes the need for regular dirty, grimy maintenance, plus a super comfortable Body Geometry saddle and grips that are 100% designed for women. The Alibi is always ready to ride, so consider it the perfect partner on your path to a fitter, better you. - The hard-working, sturdy A1 Premium Aluminum frame is light and durable, and it also features rack and fender mounts for easy portage and dry riding in wet conditions. You'll also find that it's engineered with Specialized's Fitness Geometry, meaning that you’ll go fast with maximum efficiency, but without the discomfort of an aggressive ride position. After all, the more comfortable you are, the longer you’ll ride.- There’s never a good time for a puncture, which is why the Nimbus Airless tires feature a puncture-proof core, offering incredible traction without the hassle of changing a tube.- The Alibi’s anti-rust chain keeps rolling smoothly, even after a couple of confrontations with the elements, so you can spend more time riding and less time fixing.",0.0,475.0,17,Multi-Speed,http://thebicyclechain.com/images/library/large/specialized-alibi-step-through-womens-273434-11.jpg
296446,2017 Specialized Alibi,"How many times have you been ready to ride, only to be confronted with a flat tire? Well, Specialized's Alibi wants you to be pumped up to ride, not pumping up your tires. That's why it comes with tires that don't need any air at all. That's right, you can kiss your pump goodbye, and more importantly, you can say goodbye to ever having a flat tire again. They also designed an anti-rust chain for this bike that removes the need for regular dirty, grimy maintenance, plus a super comfortable Body Geometry saddle and grips that are 100% designed for women. The Alibi is always ready to ride, so consider it the perfect partner on your path to a fitter, better you. - The hard-working, sturdy A1 Premium Aluminum frame is light and durable, and it also features rack and fender mounts for easy portage and dry riding in wet conditions. You'll also find that it's engineered with Specialized's Fitness Geometry, meaning that you’ll go fast with maximum efficiency, but without the discomfort of an aggressive ride position. After all, the more comfortable you are, the longer you’ll ride.- The Alibi’s anti-rust chain keeps rolling smoothly, even after a couple of confrontations with the elements, so you can spend more time riding and less time fixing.- There’s never a good time for a puncture, which is why the Nimbus Airless tires feature a puncture-proof core, offering incredible traction without the hassle of changing a tube.- Gender: Women's",0.0,490.0,12,Multi-Speed,http://thebicyclechain.com/images/library/large/specialized-alibi-273433-1.jpg
